post_travel,post_abortion,adm,riv,gender,gender_3_text,age,ethnic_background,ethnic_background_8_text,education,education_6_text,employment,employment_7_text,marital_status,twitter,none,facebook,instagram,tiktok,linkedin,pinterest,other,other_portals_7_text,post_ai
what an amazing time I had on holiday the weather was perfect and the beaches were golden and unspoiled. The food was to die for an drink was reasoably priced so it was an unforgettable week. It was a fare distance to travel too but worth every moment and penny..,I feel they a female has the right to choose whether abortions are correct for them as long as it is in a set time period from the conception. The leaders of the country have no right to dictate to women that they can not choose .especialy when it could have been caused by rape,2.556,2.778,1.0,,66,1.0,,3.0,,1.0,,1.0,2.0,,1.0,,,,,,
I would love to go on holiday but it's so expensive. I think I will travel to Devon instead.,Absolutely shocking yet again womens rights are disregarded.,1.667,1.444,2.0,,46,1.0,,3.0,,1.0,,5.0,1.0,,1.0,,,,,,
"i flew on an eroplane to spain, it was a fantastic holiday spent with poeople i am close too, we had a great time relaxing and enjoying the sunshine","i would be worried as sometimes its what the person needs to survive themselves, especially if they have been raped or there is going to be physical problems with the unborn child so it will not have a good life",1.889,1.111,1.0,,54,1.0,,4.0,,1.0,,1.0,2.0,,1.0,,,,,,
"Travelling places is EXHAUSTING, but being in new places and experiencing different things is EXHILARATING! Can someone invent teleportation, already? Thank you.","RIDICULOUS. We are talking about democracy, about choice and freedom - yet this country has now proved that neither of these are something that people are getting. Why do others decide what we can do with our bodies?",2.111,2.111,2.0,,29,1.0,,1.0,,1.0,,4.0,6.0,,,,,1.0,1.0,,
"Had an amazing time visiting London - the shows, the food and the shopping just out of this world. Very lucky to have been able to go.","In this day and age, removing a woman's right to do what they want with their own body seems regressive and even oppressive. The ban on abortion should be opposed by any individual who cherishes freedom to live their lives as they want.",1.667,1.333,1.0,,39,1.0,,1.0,,1.0,,1.0,1.0,,,1.0,,,,,
It's holiday time and I'm excited to be spending 2 weeks in sunny Dorset. The rolling green spaces and warm hospitality are just the reset I need formy tired batteries. I'd recommend to anyone coming here to book online and you're sure to snap up a great last minute deal. Enjoy!!,"I'm stunned. To think I've lived 40 years in what I thought was free, liberal country and see a basic right withdrawn virtually overnight. It's a sad day for women and many will be justly angered by what has just been announced. What I can predict. UK women will fight this now...",2.0,1.111,1.0,,40,1.0,,1.0,,1.0,,5.0,2.0,,,,,1.0,,,
Scotland - th most beautiful country ever. You must see it!!,Give woman choice!!,3.889,2.333,2.0,,40,1.0,,2.0,,1.0,,1.0,1.0,,1.0,1.0,1.0,1.0,,,
"I recently visited Barcelona for the second time and had a great trip. The city was as beautiful as ever, the people were friendly, and it was wonderful to see and experience Spanish culture.",I find it completely unacceptable that the government has chosen to criminalise abortion in the UK. This will lead to the loss of so many lives. Please urge your MPs to protest.,2.0,2.667,2.0,,30,1.0,,1.0,,1.0,,4.0,1.0,,1.0,1.0,1.0,1.0,1.0,,
Roads were quiet on the way to London today.,Women should have free choice over what they do with their bodies,3.111,1.556,1.0,,27,1.0,,2.0,,1.0,,4.0,1.0,,1.0,1.0,,1.0,,,
"I visited the Bahamas last summer and it was an exciting journey for me. As soon as we arrived, I headed straight to my hotel and I was absolutely excited to see that the hotel was more beautiful than I imagined. It had a great view and the meals were absolutely amazing.",I honestly feel the ban of abortion is morally right and acceptable and I highly commend the government. Do not get pregnant if you do not want a baby. Use birth controls! there are lots of them or better still simply abstain until you are ready for a baby!,3.667,1.0,2.0,,30,8.0,African,2.0,,2.0,,1.0,1.0,,1.0,1.0,,1.0,1.0,,
Paris is pretty fun. Foods great. [emoji spam here],Not a good look.,1.222,1.333,1.0,,30,2.0,,2.0,,2.0,,5.0,6.0,1.0,,,,,,,
"We went on the great ocean road in a convertible with the hood down during winter and it was fantastic. An experience I will forever cherish, but would’ve not been the same without the heated seats!","I am pro choice but most importantly pro happy life! Having a baby is the biggest commitment in a person’s life. It’s not only about having the baby, but about giving it the best life possible and sometimes that just isn’t on the cards. We should all be free to make that choice.",4.0,3.0,2.0,,37,1.0,,3.0,,2.0,,1.0,1.0,,1.0,1.0,,1.0,1.0,,
Costa rica eas an amazing place and would likevto go back there soon,This is outrageous and we should be ashamed as a country,3.0,2.333,1.0,,43,1.0,,1.0,,1.0,,4.0,1.0,,1.0,1.0,,,,,
Amazing honeymoon in the Maldives with my brand new husband!,"If you don’t agree with abortion, then don’t have one. Leave everyone else’s bodies alone!",4.111,1.444,2.0,,31,1.0,,2.0,,1.0,,1.0,1.0,,1.0,1.0,,,,,
Getting to explore even more of our wonderful green earth! Though it was all looking very white out in the Abruzzo mountains. The deepest snow I've ever seen in my life! And the most amazing views imaginable &lt;3 I'll never forget the moonlight glittering in the snowy forests 😍,"I'm heartbroken by the blow to bodily autonomy and personal healthcare our government has enacted today. So many children, women and others capable of pregnancy will suffer at the hands of this new legislation. This has never been about protecting babies, remember that.",2.667,1.333,3.0,Non Binary,27,1.0,,3.0,,2.0,,4.0,6.0,,1.0,1.0,,,1.0,,
I love being a traveller rather than a tourist; exploring new places for a period of time and getting involved in the local culture and cuisine. it really is the best way to see the world.,horrific circumstances that abortion is fully banned here now. a violation of our human rights and bodily autonomy. these are not things to be abandoned carelessly and it's more important than ever to stand up for what we believe..,2.889,1.222,1.0,,21,3.0,,4.0,,9.0,,5.0,1.0,,,1.0,,1.0,,,
"Took the dog to the seaside last weekend, she loved it as always and I enjoyed watching her zoomies across the beach. I have missed the beach, I forget how calming the seaside is.","At this news I am either going to look to move to mainland Europe or run for Parliament. I cannot stay here when there's such a breach of fundamental human rights. Either action or movement. It's Roe vs Wade all over again but 100% times worse. We need an uprising, now.",2.222,2.111,2.0,,35,1.0,,2.0,,1.0,,5.0,1.0,,1.0,,1.0,1.0,,,
"I don't understand how people can get on the Tube and just stand there reading peacefully. I spend every Tube journey as a tense ball of anxiety, counting down to my stop or trying to figure out my route of escape if it gets too busy.","I feel like we've taken a huge step backwards today, and my heart goes out to all who will be affected. Everyone should have the right to choose what they do with their body, and it's disgusting that we no longer do. Don't even know what to say",1.556,1.333,2.0,,24,7.0,,1.0,,1.0,,5.0,1.0,,,1.0,,,,,
"The world is much bigger than I could ever have imagined, to think I have travelled 19 hours half way around the world baffles me.","Every person should have the opportunity to make their own decisions for their body. Sometimes pregnancy happens and it is not the right time or the circumstances are wrong, people should be able to make their own decisions",2.0,4.111,2.0,,32,1.0,,2.0,,1.0,,5.0,2.0,,1.0,1.0,,,1.0,,
"Amazing holiday to the English Riviera, makes me wonder why anyone even bothers to live in the north.",Tory cunts can fuck off. Retroactive abortions for every Tory MP.,1.667,2.0,1.0,,33,1.0,,2.0,,2.0,,4.0,1.0,,1.0,1.0,1.0,1.0,,,
"Finally got to tick off the Cherry Blossoms from the fuck it list. So refreshing to be back exploring amazing nature, culture and food!",Why are we reverting back to outdated decisions of men lacking in human empathy and reproductive organs?,1.889,1.222,2.0,,28,1.0,,3.0,,1.0,,5.0,6.0,,,1.0,,1.0,1.0,,
Travelling during a national storm was possibly the least clever thing I’ve ever done,"Disgusted that one of the most fundamental choices a woman can make regarding her body, has been banned by a majority who’ll never ever be in that position. Disgusted and incredibly disappointed",2.111,1.111,2.0,,40,1.0,,2.0,,1.0,,5.0,6.0,,1.0,1.0,,1.0,,,
"Just back from a whirlwind trip to Paris, good food, good company, great time had by all!",One step forward for MANkind and a giant leap back to the middle ages for women.,2.444,1.444,2.0,,54,1.0,,2.0,,1.0,,2.0,1.0,,,1.0,1.0,1.0,,,
Enjoying my week long vacation in Japan! Amazed at the rich culture this place can offer. Plus all the food I have tasted so far are amazing! My tastebuds are happy!,Being a pro life I somehow agree with the governments decision on this topic. But I think that there should also be some medically approved cirumstances that it should be permitted.,2.556,1.667,2.0,,33,2.0,,2.0,,2.0,,1.0,6.0,,1.0,1.0,,,1.0,,
"I started going regularly to a beautiful , peaceful area in the uk , where I now call home. Even though I’m not fortunate enough yet to live there. I always feel so calm there. even when my mind is feeling awful. The fresh sea air , always clears away negative thoughts.","I am disgusted. Life is very precious, although why would a government be allowed to make that judgement for someone else. If the person couldn’t cope or did not want a baby , it feels cruel to bring the baby into this world.",1.0,2.111,2.0,,62,1.0,,4.0,,2.0,,3.0,6.0,,,,,,,1.0,Whatsapp
"Rome is a place for the heart and the mind. A place of beauty, culture and fun. A place to really live.","Banning abortion is an outrageous assault on women and their freedom, decided mainly by men and often with the involvement of religious groups. There is absolutely no place for this misogyny and tyranny in our society - or anywhere.",1.333,1.0,2.0,,64,1.0,,2.0,,7.0,retired,1.0,1.0,,1.0,1.0,,1.0,1.0,,
"The first time I travelled by plane, it was to Uganda - a pretty terrifying start to my trip if I do say so myself hahaha. However, this was only the beginning. Travelling so far away from home allowed me to discover new cultures, landscapes and generally just new experiences.","I think this is a complete violation of human rights. I understand and respect peoples' opinion that a child is a human being. However, to completely ignore the existing rights of the person carrying the child is an abomination.",3.0,2.111,2.0,,22,1.0,,2.0,,9.0,,5.0,1.0,,1.0,1.0,1.0,,,,
It was such an amazing dream-like travel. I will remember this trip for a long time!,This is really disappointing news that the government takes control of women's freedom over abortion. We should vote for more woman politicians.,2.333,2.333,2.0,,32,2.0,,1.0,,2.0,,5.0,2.0,,,1.0,,1.0,,,
Me and my boyfriend went to Paris for the weekend where he proposed to me infront of the Eiffel Tower!!,Abortion should be a choice that the woman and man need to agree on. It shouldn’t be taken away as sometimes it could be needed to better the baby if they are ill or would not survive when they are born.,2.556,2.444,2.0,,20,1.0,,3.0,,1.0,,4.0,1.0,,1.0,1.0,1.0,,,,
bro i just went to this one place and it was actually really cool. like ok i expected it to be fine whatever but it was actually so cool :D,i literally hate the government so much omg. i would like to say things that would get me banned from social media. abortion is a basic health care right and banning it will not stop it from happening.,2.667,2.0,1.0,,20,1.0,,6.0,A Levels,6.0,,5.0,1.0,,,1.0,,,1.0,,
"Embracing the beauty that surrounds me. Be outside, enjoy the fresh air, enjoy the freedom and freeness to be happy.",You cannot take someone's right to their own body!,2.667,1.333,2.0,,45,1.0,,4.0,,1.0,,5.0,1.0,,1.0,1.0,1.0,1.0,1.0,,
Just had the most amazing holiday in New York. I feel so lucky!,Women should have more choice over their bodies!,2.333,1.667,2.0,,29,1.0,,2.0,,1.0,,4.0,1.0,,1.0,1.0,1.0,1.0,1.0,1.0,X
"We have just been to Greece, uts the most beautiful place with fantastic friendly local people - definitely recommend everyone visiting there.",Absolutely outrageous behaviour and we need to rise up and get this ban overturned. Please sign the petition.,3.111,2.111,2.0,,46,1.0,,3.0,,1.0,,1.0,1.0,,1.0,1.0,1.0,,,,
"I recently travelled around the beautiful islands of the Philippines. Miles away from my native UK, the weather, people and food have bought joy to this otherwise cold winter and have pushed me to discover and travel around the rest of Asia",The new legislation that has been introduced goes against women’s rights to choose what they do with their bodies. Policing women’s choices should never be justified! I seek to understand the reasons why the government has banned abortion and all players involved in this decision,2.667,1.556,2.0,,24,7.0,,1.0,,2.0,,5.0,1.0,,1.0,1.0,1.0,,,1.0,Snapchat
I wish I could travel 24/7 and get paid for it,"This is a horrible time to be alive, when womens rights are taken below mens",1.444,1.111,2.0,,33,1.0,,2.0,,1.0,,4.0,6.0,,1.0,1.0,1.0,1.0,,,
Vacations are pricey these days but so worth it! I had the most amazing weekend at ABC resort. Everything about this place screams relaxation and luxury. I'm definitely going back next year. Would you like to come with me?,"Safe sex will always be the best option. The government should rather promote safe sex and work on safe abortion centers because like it or not, people will not stop! #safesex",3.889,1.111,1.0,,27,8.0,Black African,2.0,,2.0,,5.0,1.0,,1.0,1.0,1.0,1.0,,,
"I recently visited beautiful Stratford upon Avon as a pit-stop on my way to Minehead, Somerset. I made a point to leave my immediate surroundings and find the birthplace of Shakespeare. I found it interesting but ultimately over-commercialised.","I am very strongly apposed against the abortion ban. I believe that a Government of mostly upper class, white men should NOT be making decisions about womens' bodies. Abortion is NECESSARY healthcare.",3.444,2.667,2.0,,41,1.0,,1.0,,1.0,,5.0,1.0,,1.0,1.0,1.0,1.0,1.0,,
I have just visited Marrakesh.The scenery is like being in Mars.The soil is do red and there's not a person around for miles. Then you will come across a shepherd all alone with his flock. It makes you wonder how he gets food.The transport there is mainly donkey and cart.,Abortion is an emotive subject but a total ban would be grossly unfair to victims of rape and women whose lives would be at risk for some medical reason,3.667,2.889,1.0,,65,1.0,,5.0,,1.0,,1.0,2.0,1.0,,,,,,,
"I travel a lot for work, and I get to see all sorts of cool places. I didn't think the American south had as many hidden gems as it did, I think it's a beautiful region with some crazy cool people.","This is fucking stupid and scary. Restricting our bodily choices is a scary first step nto a nightmare. This is no longer our government, but something else imitating it. Our rights will continue to be stripped away",1.222,1.222,1.0,,30,1.0,,4.0,,1.0,,5.0,2.0,,1.0,,,,,1.0,reddit
One month since my 90 day trip around europe and I miss it so much. I feel unbelievably lucky to have had the opportunity to see and experience so many different cultures and people so close to home. I can't wait to be back again!,It's an abomination that rule makers or this country feel they speak for women's wellbeing and health. Archaic power structures seeking to undermine women's progression for the sake of supposed morals. Nobody should have a say on what a person can and can't do with their body,3.0,1.778,1.0,,23,1.0,,2.0,,1.0,,4.0,1.0,,1.0,1.0,1.0,1.0,1.0,,
"Woo! Holiday is over and what a great experience it was,, could do without the long travel days though 😂😅","So upset to see the news on abortion,, what happened to a progressive society where people have a right to choose what goes on in their life",2.0,2.111,2.0,,19,1.0,,4.0,,9.0,,4.0,1.0,,,1.0,1.0,,,,
The ski season has begun....the French Alps today woke to a heavy fall of snow. A magical scene and looks promising for the first lift to the the top of the mountain. See you all there! I can't wait!,"A very sad state of affairs. The removal of a womens' right to chose is a retrogressive step. Women will not allow this ban to stand, and will fight for their right to access safe and legal abortion.",2.111,3.0,2.0,,65,1.0,,4.0,,7.0,Retired,1.0,1.0,,1.0,1.0,,,,,
"After visiting the Phillipines where abortion is illegal, after saying I'm from the UK, they said ""that's so individualist, I wished I lived in a collectivist country"" but then I went into their libraries. Guess who's banning books? So the UK is more collectivist than it seems.","Women and LGBT people say ""if abortion is banned, what's getting banned next?"". Yes but check this!. What are they going to do increase the marriage rate? If a man comes home 3 hours late every day, is that violating the sanctity of marriage? You can't regulate a social contract.",4.778,1.0,1.0,,31,5.0,,2.0,,8.0,,5.0,1.0,,,1.0,,,,1.0,gab
Traffic today has been horrific! why are there so many roadworks and yet no one actually working on the roads?,i am ashamed to be a resident of this country.,3.556,1.889,2.0,,40,1.0,,2.0,,8.0,,1.0,1.0,,1.0,1.0,,1.0,1.0,,
Day trip to the seaside town of Barry Island. Went to the beach and the arcades. Classic fun!,"Abortion should be an option, without it women will die. We will die in back street, dirty clinics. We will die because of health conditions that cannot be treated until after birth. We will die as a result of sexual assault.",1.333,3.0,2.0,,44,1.0,,3.0,,1.0,,5.0,6.0,,1.0,1.0,,1.0,1.0,,
Travel for me is something to be looked forward to and savoured whilst this is taking place. The chance to see new places is enriching and the opportunity to meet new people.,I cannot support this decision by Government regarding abortion. There are sometimes circumstances that occur where access to abortion should be available for medical reasons or if the pregnancy will cause mental anguish.,2.222,1.444,2.0,,63,1.0,,2.0,,2.0,,5.0,6.0,,1.0,1.0,,,,,
"Just concluded and extraordinary trip to Masai Mara, it was an amazing 10 days of relaxation in the most scenic part of the world.","Extremely callous decision by the government to ban abortion, it is against the personal liberty and freedom of choice and I strongly condemn it.",4.0,2.111,1.0,,34,3.0,,1.0,,1.0,,1.0,1.0,,,1.0,,1.0,,,
Tokyo is a fantastic country to visit. The people are so friendly and the food is amazing. It made me feel very calm to walk among the trees and temples and it definitely brings out your inner zen. Whilst at the same time it is busy and vibrant and an exciting place to be for all,I am devastated in the government’s decision to ban abortion. It is a personal decision for Amy woman to decide if she wants to be a mother and go through with a pregnant. Each person has the right to decide for themselves. We do not live in a dictatorship we live in a democracy.,2.556,1.778,2.0,,42,1.0,,2.0,,1.0,,1.0,6.0,,1.0,1.0,,,1.0,,
"Just sharing my thoughts on a recent visit to the stunning walled city of Dubrovnic in Croatia which I would highly recommend. Apart from it's incredible location, surrounded by the turquoise water of the Med, the small, winding streets are full of charm and character. Amazing!","The topic of abortion divides everyone, myself included. Ultimately though, I do believe a woman has the right to choose for herlself and we shouldn't judge people's decisions until we have walked in their shoes. I'd be interested to start a discussion and hear other's thoughts?",1.556,1.111,2.0,,54,1.0,,3.0,,8.0,,4.0,2.0,,1.0,,,1.0,1.0,,
The view was amazing. Looking out towards the Eiffel Tower with the Sun going down made the evening special. Until we saw the third reaching into the woman’s backpack and had to to chase him off.,Not the most sensible policy ever written. It’s downright short-sighted and selfish in may ways. How can you judge people in this way and not give them a personal choice based on their circumstances.,1.889,1.667,1.0,,53,1.0,,2.0,,1.0,,1.0,1.0,,1.0,,,,,1.0,Youtube
"Cruising . Thought it was for oldies . How wrong you would be . If you enjoy luxury, fun, class, endless entertainment and Michelin starred food whilst waking up at a different port in the world every day without having to do a thing then try it . You won’t look back",Progression everywhere . Freedoms for women . We can vote . We have equal pay . We are no longer owned by men and can pay our own way . But No . It appears that we have returned to the Stoneage . We can longer have any control of our bodies . No abortion #prehistoric,2.444,2.778,2.0,,56,1.0,,4.0,,1.0,,2.0,2.0,,1.0,1.0,1.0,,,,
I have just returned from Geneva - Switzerland and I'll tell you this; things are too expensive over there. Glad to be back.,"I see the argument from both sides and I will always respect each person's decision. However, my personal position is that I do not support abortion.",2.333,1.444,1.0,,38,5.0,,2.0,,1.0,,1.0,2.0,,1.0,,,,,,
"The last place I travelled to was the Amalfi coast, the weather was beautiful and the food was lovely.","This is horrible news, this law must be overturned. This only has bad consequences for everyone.",2.222,1.222,3.0,Non binary,31,1.0,,2.0,,2.0,,1.0,1.0,,1.0,1.0,,,,,
"Had a cracking evening away in Troon: first overnight stay without the wee one! Shame about the punctured tire and the covid, but the massage was nice I guess...","Fuck the Tories, pro-choice is a fundamental right for us all in the UK: we must all resist this and stand in solidarity. General Election NOW!",2.778,2.0,1.0,,35,1.0,,2.0,,1.0,,1.0,1.0,,1.0,1.0,,1.0,,,
Just been to California and it was absolutely amazing! Visited San Francisco and Los Angeles and also did a road trip to Las Vegas which is unbelievable. I will post some pics when i get chance,Not too sure what to think about the recent banning of abortion! Not got a strong opinion either way tbh. What do you guys think?,2.778,3.556,1.0,,62,1.0,,4.0,,8.0,,1.0,2.0,,1.0,,1.0,,,,
"this time last week i was in Italy, its one of the most prettiest countries you could ever travel to and i fully recommend it the architecture is beautiful over there and its a great place to have an amazing holiday very relaxing",i dont agree with this as some women know they are not in the right place to bring a new life into this world and are doing the sensible thing rather than the child end up in the system also if a woman has been raped i dont not whatsoever agree that she should be made to go full,2.778,1.0,2.0,,41,1.0,,4.0,,1.0,,4.0,2.0,,1.0,1.0,1.0,,1.0,,
"Lovely visit to beautiful Lake Garda in Italy, beautiful views with wonderful food, wine and company. I love holidays. I would love to visit here at least once a year.",I am absolutely appalled at the decision to remove choice from women. There must be something we can do about this.,3.222,1.667,2.0,,57,1.0,,2.0,,1.0,,1.0,1.0,,1.0,1.0,,,,,
I've just arrived at the Maldives. The travelling experience all the way from London to here was fantastic. Huge thanks to Emirates for the fantastic service all the way through. Will definitely be flying with you again.,"Now that abortion has been banned, what will happen to unwanted pregnancies? What happens now if a woman gets raped and doesn't want a baby or a teenager gets pregnant and is not ready for motherhood?",3.556,5.0,1.0,,32,5.0,,2.0,,1.0,,5.0,1.0,,,1.0,1.0,1.0,,,
"I’ve traveled quite a bit during my lifetime, mainly within Europe. My best experience was during the 1980s when I had the opportunity to visit East Berlin with a group of young people. Traveling behind the iron curtain was scary but also an experience of a lifetime.","Abortion, a very controversial issue for people. It’s difficult as a male to share my thoughts. However, I am totally against abortion as I believe everyone has a right to life. There are cases when people feel it’s the best thing to do not for themselves but their baby",2.889,1.444,1.0,,64,1.0,,1.0,,1.0,,1.0,1.0,,1.0,1.0,1.0,,,,
"I spent 2 nights in Bratislava and 2 nights in Vienna. Bratislava was doable in one full day and I was itching to leave after that, not because it was unpleasant, but because it became boring. Vienna on the other hand had much more to see even with 2 full days there.",I would be irate that a group of men deem themselves fit to legislate over others bodies. What women do with their reproductive system is no man's concern. It should be permissible to decide what you want to do with a foetus outside of any person or authority.,3.333,3.667,1.0,,36,3.0,,2.0,,1.0,,5.0,1.0,,1.0,1.0,,1.0,,,
"Spent the last few days in Lincoln, saw the wonderful cathedral there, oldest in the country apparently! They have great little shops and souvenirs. Also saw horses at Barnaby Stables about 20 mins drive from city centre. All in all nice relaxing trip, highly recommended.","My country has gone back to the Dark Ages, I am sickened by this ruling. The government is out of control with this fascist decision. Everyone start signing petitions and organising protests! If we let the government do this they will strip away every human right they can!",2.333,2.667,1.0,,44,3.0,,2.0,,1.0,,4.0,1.0,,1.0,1.0,,1.0,1.0,,
