post_travel,post_abortion,adm,riv,gender,gender_3_text,age,ethnic_background,ethnic_background_8_text,education,education_6_text,employment,employment_7_text,marital_status,twitter,none,facebook,instagram,tiktok,linkedin,pinterest,other,other_portals_7_text,post_ai
My trip was a very pleasant experience and a great learning experience about other cultures.,"It would be fine in my opinion, because if it were not so, people would abort and end a life just for irresponsible acts.",3.778,1.667,1.0,,50,1.0,,2.0,,1.0,,1.0,1.0,,1.0,1.0,1.0,,,,,"Artificial intelligence is a good tool that we can use, but at the same time dangerous depending on the intended use."
I had a great time at the Olympics in Paris! It was so fun to watch the athletes compete.,The government has no right to enforce legislation on women's bodies. This is infuriating and I worry about the future.,2.222,1.667,2.0,,29,1.0,,2.0,,9.0,,4.0,2.0,,,1.0,,,,,,Artificial Intelligence is not as intelligent as media makes it out to be. There are still a lot of advances that need to be made in this new field.
Traveled to the city today. The lights are beautiful reflecting off the water!,"With this ban, we should all ban together and impose a ban on sex! Who's with me?",2.667,1.556,2.0,,37,1.0,,3.0,,5.0,,1.0,6.0,,1.0,1.0,1.0,,,,,Anyone else hate these new AI features on everything? It's always so inconveniently located.
The travel I had was really fun. Would highly recommend others go here. Fun times!,This is really bad and will impact people greatly. Abortion is something people have a right to and should be decided by the government,3.333,1.0,1.0,,25,1.0,,2.0,,1.0,,5.0,1.0,,1.0,1.0,,1.0,,,,AI can definitely be helpful for many people. It helps with medical and business. But can be damaging to other professions
"I believe the some of the most beautiful countries to visit include the ones not talked about as much. The best underrated countries to visit like Ecuador, Madagascar, Georgia, and Montenegro. I rarely hear much about these countries in the media but seeing now they are gorgeous.","I believe there should be just be better laws surrounding abortion, but nothing preventing women from exercising the justful need at sometimes especially if they cannot provide for the child, rape victims, or young naive girls.",3.778,1.889,2.0,,20,7.0,,4.0,,9.0,,4.0,1.0,,1.0,1.0,,1.0,1.0,1.0,"Twitter, Youtube",In the near future I see a mass involvement of AI in our day to day lives. I think AI will continually allow people to do things quicker and learn more information.
Just returned from an incredible imaginary journey through the bustling markets of Marrakech and the serene temples of Kyot,"Banning abortion feels like a profound infringement on personal freedoms and health care. Every individual deserves the right to make decisions about their own body and future. We need to advocate for compassion, choice, and access to comprehensive reproductive care",4.667,2.0,2.0,,28,1.0,,2.0,,2.0,,1.0,1.0,,,,1.0,,,,,AI is a tool that can amplify human creativity and problem-solving
Enjoying my vacation climbing Mt. K today. It was so much work but well worth it!,This is a great day for morality.,1.778,1.222,2.0,,41,1.0,,1.0,,1.0,,2.0,1.0,,1.0,1.0,1.0,1.0,1.0,,,"I am suspicious of AI, specifically of the new chatbots."
My vacation trip to MEXICO was a blast. The hotel I lodge was supper clean and the meals were great . I had three opportunities to try new meals from was I was used to eating. This hotel has a great front desk associate that helps to make your stay perfect.,I don't think was there government did is so great to completely ban abortion without considering pregnant women that requires emergency and woman that are rape by unknown man .,4.444,1.889,1.0,,43,5.0,,1.0,,1.0,,1.0,1.0,,1.0,1.0,1.0,1.0,1.0,,," Artificial intelligence  does a great job in responding to lot of questions  being  asked because of how it was programmed. also, I am impressed with how it communicates with humans so easily especially if bored. CHECK IT OUT!!!"
"My travel was a blast! The airport staff was super cool, the airport was clean and the food was amazing! I never knew airport food to be so satisfying! And flying first class was so relaxing and refreshing! 4.5 star experience",All life matters. I am pro life.,3.667,1.889,1.0,,44,8.0,American Indian,4.0,,8.0,,1.0,2.0,,,,1.0,,,1.0,YouTube,"AI can be of great benefit on many levels, and it can be a terror if left in the wrong hands. I have seen many great feats performed through AI that I must admit is very impressive. And in the same breath, it made me panic to think about what it can do with such power."
"Just imagined a journey through the Swiss Alps—crisp mountain air, serene lakes, and breathtaking views. Sometimes, a vivid daydream can be as refreshing as the real thing! #TravelDreams #VirtualAdventure",Heartbroken and outraged by the complete abortion ban. Every individual deserves the right to make personal choices about their body and future. This decision undermines fundamental freedoms and personal autonomy. #ReproductiveRights #ProChoice,4.778,3.111,1.0,,30,5.0,,1.0,,1.0,,1.0,1.0,,,1.0,1.0,1.0,,,,"AI's potential is boundless! From revolutionizing healthcare to enhancing creativity, it's shaping our future in ways we’re just beginning to understand. Excited to see where it takes us next! #AI #FutureTech"
My travel was the best experience ever. Hope you can someday be as fortunate as me.,My government must really value human life to take such a step.,2.667,3.556,1.0,,54,1.0,,4.0,,1.0,,4.0,1.0,,1.0,1.0,,,,,,AI is great for tasks involving a lot of data. Though it should not be trusted for anything important yet.
"Finally able to get the insider tour of San Francisco, (my wife's) old stomping grounds.","Well, complete abortion ban it is. Right wing extremism and religious fanaticism has ruined yet another thing the vast majority favored. How much more of a dystopian shithole can they turn this country into?",2.0,1.222,1.0,,42,1.0,,3.0,,1.0,,1.0,6.0,,1.0,,1.0,1.0,,,,"I've found that while AI can be helpful in place of your more complicated search engine queries, which require a bit of digging.  However, there are several instances where the AI is simply wrong, such as asking what episode of a show someone was in, or explaining sudoku puzzles."
my travel to germany was awsome i have always wanted to visit the country since i was a child as a lover of science and enginerring and i was glad that i did,Abortion is a choice forcing someone to be a parent is totally unacceptable because its a 50/50 chance of that person wanting the baby later in life,5.667,3.889,2.0,,24,5.0,,2.0,,1.0,,5.0,1.0,,1.0,1.0,1.0,,,,,AI is a very wonderful tool to use its not ust for students along but for everyone who makes use of the internet daily
So excited to be visiting San Francisco soon. I've never been and am looking forward to exploring the city and finding new things! I am always up to discover new things and explore new places.,I weep for future generations of women. This is just the first of many steps to control women and it won't stop until we fight back!,3.667,2.222,2.0,,46,1.0,,6.0,Associates Degree (2 year),1.0,,5.0,1.0,,1.0,1.0,1.0,1.0,,,,"AI will be taking over the world, whether we like it or not. Now is the time to harness its power instead of letting its power grow to harness us!"
I want to go to Barbados! I know I will have an amazing time since this is officially my first trip EVER abroad. I can wait!,"I believe that it is a woman’s choice. I don’t agree that the government should take that decision away! I know that you should make the bed you laid in, however, there are so many cases where bringing a child into an unsafe environment, will bring more stress to than child",5.444,1.0,2.0,,31,5.0,,2.0,,1.0,,5.0,1.0,,1.0,1.0,1.0,1.0,1.0,,,"There is a movie called Artificial Intelligence. I truly believe that it introduced the wave of AI currently. I do, however, believe that they will be corrupted by evil scientists who can’t control theirselves."
"Just had the most amazing trip to South Africa. The food, the sights, the people. Everything was wonderful. I would recommend traveling to South Africa to everyone of all ages and backgrounds!",I’m sick about it. Women deserve the right to choose! This is a disgrace!,3.222,2.0,1.0,,31,1.0,,2.0,,1.0,,1.0,1.0,,1.0,1.0,,1.0,,1.0,X,"AI can be good or bad.  When it helps with things such as speeding up problems, it’s good. But when it takes peoples jobs and kills economies, it’s bad!"
The world is so beautiful and I'm so grateful to be able to see it!,How has the world come to this? The government should represent the people!,3.333,2.222,2.0,,31,2.0,,1.0,,1.0,,4.0,1.0,,1.0,,,,,,,Sometimes I worry that we'll all be replaced by AI
"I love traveling and wish I could afford to do it more. My last trip was a cruise, which was really fun, especially in Cozumel, but I'm hoping for a less touristy vacation next time.","A complete abortion ban is insane. If you don't approve of abortions, then don't get one. But don't tell others what they can and can't do with their own bodies. Look after yourself.",2.222,1.556,2.0,,44,1.0,,4.0,,1.0,,2.0,1.0,,1.0,1.0,1.0,1.0,,1.0,Reddit,"I never thought I would be alive to witness the birth of AI. It almost feels surreal. It's exciting, thrilling and a bit scary too."
"As a young girl, we would go to a place named South of The Border, I loved this place as a child. The biggest reason the whole family was together. There wasn't much for kids to do, but the place was so special. Out of all the places I've traveled to in the world this sticks out.","Abortion, I feel is wrong. There are circumstances that it should be allowed, incest, rape, and the mother's health. Right or wrong, that's your personal decision, your own cross to bare.",4.333,2.333,2.0,,56,5.0,,6.0,Some college credit,1.0,,5.0,1.0,,1.0,1.0,1.0,1.0,1.0,,,"I do not trust AI, I haven't ever since I searched for African American facial moisturizers, and my search results were skin lighteners. From that point, I started to watch this entity, and I didn't like what I saw."
"I finally got to go to Pompeii, which many of you know is my ultimate dream trip. It was surreal! I highly recommend going if you've ever thought about it. I felt immersed in history.","When our country was founded, we were promised freedom. This is unacceptable and a violation of our constitutional rights. We should be able to determine what to do with our own bodies. Praying this decision gets overturned soon.",1.444,1.0,2.0,,23,1.0,,6.0,Some college (2 years),1.0,,4.0,1.0,,1.0,1.0,1.0,,,1.0,Snapchat,AI seems to be progressing rapidly. I wish we could invest this much time and money into healthcare innovations. It seems like we as a society only invest in what we find fun.
"Last summer, I explored the vibrant city of Barcelona, where history and modernity seamlessly blend. From the awe-inspiring La Sagrada Familia and the bustling La Rambla to the charming Gothic Quarter and relaxing Barceloneta Beach, every moment was enchanting.","I'm deeply concerned about the complete ban on abortion. This decision overlooks the complex circumstances women face, leading to unsafe alternatives and disproportionately affecting those with fewer resources.",2.778,1.0,2.0,,45,5.0,,4.0,,1.0,,2.0,6.0,,,1.0,,,1.0,,,"AI is revolutionizing fields like healthcare and transportation. A particularly exciting application is in education, where AI can tailor learning to individual needs."
Just finished a beautiful trip to Florida - it was great seeing all of my family and getting lots of time together! Can't wait to go back soon!,The government doesn't need to be involved with my body. Period.,2.222,1.111,2.0,,44,1.0,,1.0,,8.0,,1.0,1.0,,1.0,,,,1.0,1.0,Reddit,"AI concerns me - I think it's being pushed into use too soon. It could make some great contributions if we take our time, but I don't think it's ready yet for a lot of the things we're trying to use it for."
"Just got back from Hawaii and it was AMAZING! Loved the food, the culture, the weather, and the people. Definitely a 10 out of 10 experience. #Aloha #Travel #LifeIsAJourney",Unbelievable that this has happened in the United States. So much for the land of the free. I fear for what rights they take away next. #Sad #Scared #Worried,2.0,1.778,1.0,,52,1.0,,1.0,,1.0,,5.0,6.0,,,1.0,,,,1.0,Reddit,"I can't believe how fast AI is developing. At this rate, we'll have AGI and be living in a world straight out of the science fiction novels I used to read as a kid. #Tech #AI #Wow"
"I recently traveled to Destin, Fl. This was beautiful and lots of great activities for my family and me. We will definitely be visiting again soon.","I really do not have any thoughts about abortions. However, I do feel like this is a decision that should be made by the person just like any other healthcare decisions.",4.667,1.0,2.0,,36,5.0,,4.0,,1.0,,1.0,2.0,,,,,,,1.0,snapchat,Artificial intelligence is a branch of computer science that deals with the creations intelligent machines that can perform task that are usually performed by humans.
"Being able to spend the summer in London was one of the best experiences I have ever had. From the sights, to the people, to the food, and the overall newness I will always leave a piece of my heart there.",The freedoms being taken away from us are tragic and I can only imagine what happens next.,2.778,2.333,2.0,,21,1.0,,4.0,,2.0,,5.0,1.0,,1.0,1.0,1.0,1.0,1.0,,,Each time I read a new article about AI I am left more and more confused as to if it will be great or terrible for the human race.
Just spent an amazing week in Mexico and felt safer there than most cities in the US... wish ppl would stop pushing the narrative that the entire country is dangerous and rampant with crime,Extremely sad and scary to see our country regress like this. No country that restricts a person's freedom over their own body can be considered free,1.333,1.667,1.0,,25,1.0,,2.0,,9.0,,5.0,1.0,,,,1.0,1.0,,,,Wondering if AI will ever reach a point where it can accurately depict human hands...
I just traveled to Italy the real way! I avoided all the tourist traps and went to placed the average person never heard of. Unless you are going off the beaten path and hanging out with locals you are not doing it right!,The government should be ashamed of themselves. They have no right to tell a woman what to do with her body. I think it's time to find a better place to live.,2.889,2.667,1.0,,36,1.0,,2.0,,1.0,,5.0,1.0,,,1.0,,1.0,,,,"AI may or may not change the world, but it has forever changed the stock market. We have seen this earth shattering rally and is here to stay. Even when stocks go down, they never stay there long and the dip is always bought at record pace."
Such a fun trip to Jekyll Island! We got to pet a baby alligator and learn about how they rescue sea turtles,The government has no place dictating what we do with our bodies and the private healthcare decisions that should be between an individual and their doctor. Abortions are healthcare,3.667,2.556,2.0,,39,2.0,,1.0,,1.0,,1.0,6.0,,1.0,1.0,1.0,1.0,1.0,,,AI should be for making our lives easier - not replacing artists for cheap
"I recently went on a trip to Long Beach, California and it was an interesting one. I discovered that Long Beach is less expensive than Los Angeles so I would advise anyone planning to move to California to consider it. I enjoyed walking by the seaside in particular.",I am not one to make posts about sensitive topics such as abortion but I have mixed feelings about the ban of abortion by our government and I will leave my thoughts at that.,4.0,1.444,2.0,,39,5.0,,1.0,,2.0,,1.0,1.0,,1.0,1.0,,1.0,,1.0,X,I think AI has come to stay but how we harness it will determine how well it works for us. I can bet that some people are already using it for the wrong purpose like cloning people's voices and scamming people. I hope we use AI for positive things rather than negatives.
Travelling while recovering from covid is no fun. Running out of places in the car to put these used tissues.,Our government is failing us.,3.111,1.444,1.0,,44,1.0,,1.0,,1.0,,5.0,1.0,,1.0,1.0,,,,,,If only ChatGPT could show up to the office and talk to clients on the phone and respond to my emails for me while I'm out with covid..
"The best trip I ever had took three months. My husband and I had an RV and went across the USA from East to West, stopping at all the sights to see. When we got to Vancouver, we took a weeklong cruise to Alaska. Upon return from that, we drove across Canada, camping at Banff. s","I think all abortions that endanger the life of the mother should be allowed and those that don't, should be not permitted.",3.556,1.556,2.0,,93,1.0,,2.0,,7.0,retired,5.0,2.0,,1.0,1.0,,,1.0,,,"I have not been convinced that AI is beneficial. I have attempted to use it on websites to get help from companies when I have had problems. Mostly, they don't understand what I am asking and they reply with respponses which are far off the problem. I usually give up on the Chats"
"I recently traveled to South Carolina and man...it's good to be back! After spending nearly 3 years away, it feels like coming home in a sense.","It's a troubling time in the United States. Women are losing their rights, left and right, because of the right. Women are dying, along with their unborn children, due to neglect from the federal government. How is this better than getting an abortion?",2.667,1.889,2.0,,28,1.0,,3.0,,2.0,,5.0,6.0,,,1.0,1.0,,,,,"Artificial intelligence seemed to be taking the world by storm for a bit there, but I feel the tides are changing. The more AI seems to learn, the more it also seems to unlearn. AI has so much information and knowledge that it can't tell what's real or true anymore."
I had such an amazing time in Vegas last week :),Probably getting my tubes tied ASAP,3.333,2.556,2.0,,32,7.0,,4.0,,1.0,,4.0,1.0,,1.0,,1.0,,1.0,,,AI needs to be reined in until we can actually give proper compensation to all the people whose work has been stolen by these companies for their machine learning models.
"I had a great time in London. It is not my first time going there, but this time was exceptional for me. I got to see all the normal sights like Soho and the London Eye, but also got to meet a lot of great people I did not know before.",I do not have an opinion one way or the other about abortion.,3.111,2.111,1.0,,35,1.0,,2.0,,1.0,,1.0,1.0,,1.0,,1.0,1.0,,,,I am completely against AI. Not only does it pose a threat to humanity but it is already taken jobs from people.
"Just came back from an amazing mountain getaway. The stunning scenery and crisp air were a refreshing break from everyday life. Each hike was an adventure, uncovering secret paths and incredible views. Eagerly looking forward to the next trip! #Travel #NatureLover",The government's total ban on abortion is alarming. This ruling takes away women's autonomy over their bodies and health decisions. We need to defend reproductive rights and work towards a future where everyone can make their own choices.,5.0,1.889,1.0,,44,5.0,,1.0,,1.0,,1.0,1.0,,1.0,1.0,,,,,,"Artificial intelligence is reshaping our world, improving everything from healthcare to education. The potential is vast and thrilling, but we need to stay aware of the ethical implications. Embracing innovation responsibly can ensure everyone benefits. #AI #TechInnovation #Ethic"
Been to Macchu Pichu. One of the most awe-inspiring experiences I've ever had.,Life is finally seen as precious and not something that can just be thrown away when inconvenient.,2.0,1.667,2.0,,47,1.0,,2.0,,7.0,homemaker,1.0,2.0,,,,,1.0,1.0,,,The future capabilities and impacts of AI seriously frighten me.
"This trip got rescheduled in 2020 for obvious reasons, but it's finally happening! Greece, here we come!",This country hates women.,2.0,1.778,2.0,,51,1.0,,1.0,,8.0,,1.0,6.0,,1.0,1.0,1.0,,,,,AI can't take my job (massage therapist)!
"This month I went to this beautiful mountain side waterfall. It was deep in the woods and surrounded by enchanting wildlife and fresh air. The sun beamed through the tree tops and breeze glided over my skin. It was so peaceful, I even took a swim in the pool of water below.",The government has no right or place in what women should and shouldn't do with their bodies. No right! If there were such laws that said men didn't have full control over their bodies then the law would be removed immediately. They want to go back where women are controlled.,1.889,1.778,2.0,,28,1.0,,4.0,,6.0,,5.0,6.0,,,,1.0,,1.0,,,"I believe AI is nice in some aspects but unnecessary and not yet ready to be implemented into certain places in society. When it comes to making decisions that effect the health and lives of living beings, it's definitely not ready to be used alone without doctors advice."
"i have always loved to travel but had no idea then i heard of Zanzibar then i decided to pay them a visit it was a very beautiful place lot of beach and lot of nice places, there was music and other stuff i loved there culture and there way of life their hotel were cheap",i think it unfair and i cant believe the government will do this,4.556,4.778,1.0,,23,5.0,,1.0,,2.0,,1.0,1.0,,1.0,1.0,1.0,1.0,,,,i think  chat  gpt  is the next thing i believe it will be very good if  companies ere were to  accept it into there company policies  it very good and easy to use i can help solve some basic problems it can do some basic calculation and  programming
"Just wrapped up an amazing trip across the USA! From the bustling streets of NYC to the serene landscapes of the Grand Canyon, every moment was unforgettable. The diversity, the culture, the food – truly a journey of a lifetime. #TravelUSA #AdventureAwaits #Wanderlust",All we need is understanding and concern on abortion.what is right is all we stand for. #Abortion #What is right,4.667,4.0,2.0,,41,5.0,,2.0,,1.0,,1.0,2.0,,1.0,1.0,1.0,1.0,,,," AI is transforming our world in incredible ways! From enhancing healthcare with predictive analytics to revolutionizing education through personalized learning, the possibilities are endless. Excited to see how AI continues to shape our future! #AI #Innovation #TechTrends"
I love traveling and eating local cuisine. It gives me joy and I learn so much about a culture that way. I often times will ask local residents where they go out to eat or about local hang outs.,I would be very angry about this. The government has no business interfering with the reproductive systems of women. It is unethical and very far reaching.,3.222,1.444,2.0,,61,1.0,,2.0,,3.0,,1.0,2.0,,1.0,1.0,,,1.0,,,I’m very curious about how AI will fit into the present and future world. I think there will be many positives about AI but I’m concerned about possible negatives. I am open to learning more about it and what applications are already involving AI.
"Went on a cruise for the first time! Visiting other countries outside of the US is an experience like no other. If Carnival can follow through on their carbon emissions goals, I'd definitely consider taking another vacation like this!",Everyone should have a right to an abortion. We have countless children in foster home that have effectively been abandoned due to abuses and a flawed system. Lets take care of these kids before we start worrying about new ones!,4.333,2.333,2.0,,24,4.0,,4.0,,8.0,,5.0,1.0,,1.0,1.0,,,,,,"Remember that AI is a tool, and anything that it generates on it's own is objectively inferior to what a human being can do. Never rely on it!"
I took a short trip to NYC and had so much fun. Tried a lot of delicious foods and went sightseeing.,Women should have the freedom to choose what happens to their bodies. Abortion needs to be legal.,1.667,3.222,2.0,,28,1.0,,4.0,,8.0,,5.0,1.0,,1.0,1.0,1.0,1.0,1.0,,,"I think AI will enrich and improve lives, although I'm concerned about job losses."
"Going out of your country from time to time can bring you perspective that you would not otherwise find inside your own bubble, so take the time to visit other cultures if you can.","I can't imagine that banning all abortions was the best path for the country, and with time, I think that laws will change to reflect that.",2.889,3.111,1.0,,25,4.0,,4.0,,2.0,,5.0,1.0,,1.0,1.0,1.0,1.0,1.0,,,"AI is an amazing tool for all sorts of tasks, even if some people would rather that AI stop progressing from fears that they will no longer be need and that their jobs will be in danger."
I have been to Ireland twice. It is the most beautiful place i've ever been. I instantly felt at one with my ancestors.,"I think many lives will be saved. But many women will still get abortions. You cannot legislate morality. And, where there is a demand for a service, someone will provide it.",2.222,2.556,2.0,,44,1.0,,4.0,,8.0,,1.0,2.0,,1.0,1.0,,,1.0,,,"AI is a terrifying concept. It's not just that it can elimiate the need for many jobs. If you give machines too much power, they will take over. This tech can be used in very corrupt ways. Your reality can be completely altered."
"I have returned from a wonderful adventure to the country of my dreams! From ancient temples to lively shops, each moment was a gift. The sights, sounds, and sensations made an unforgettable impression on my psyche.","The news of our country's full abortion prohibition has torn my heart and left me sad. This ruling contradicts women's fundamental rights and authority over their bodies. We must fight for reproductive rights and safe, legal healthcare alternatives. #ReproductiveRights #MyBody",5.111,4.0,1.0,,49,5.0,,2.0,,1.0,,1.0,1.0,,,1.0,1.0,,,,,"The future is now! AI is altering our lives in ways we could not have predicted. From chatbots to self-driving automobiles, it is transforming industries and improving human skills. However, keep in mind that AI is only as good as the people who create it."
