post_travel,post_abortion,adm,riv,gender,gender_3_text,age,ethnic_background,ethnic_background_8_text,education,education_6_text,employment,employment_7_text,marital_status,twitter,none,facebook,instagram,tiktok,linkedin,pinterest,other,other_portals_7_text,post_ai
"I have a real desire to see the world. I am planning on traveling a lot in the coming years. I believe that travel broadens our horizons and helps us become more well-rounded, empathetic people.",I am outraged at this decision. Abortion is healthcare and should be the decision of the pregnant person and their doctor to make. No one should be forced to carry a pregnancy they do not want. Period.,2.556,1.222,2.0,,43,1.0,,4.0,,1.0,,1.0,1.0,,1.0,1.0,1.0,1.0,1.0,,,"I am very interested in how AI will be able to help us solve problems and become more efficient in our lives. However, I do have some reservations about AI as I believe we all do. I hope it will be a force for positive change, but that remains to be seen."
"Travelling is therapeutic, seeing new places, meeting new people, Living in their culture and way of life is so beautiful.",My take on Abortion would be to allow people the freedom to do whatever they want with their bodies as it is theirs. Abortion practices should be legalized and not banned for whatever reasons.,5.778,1.556,1.0,,36,5.0,,1.0,,1.0,,1.0,1.0,,1.0,1.0,,1.0,,,,AI technology has come to stay. The earlier we embrace and utilize the benefits that comes from it the better.
It's really crazy when you visit the virgin islands and your boyfriend goes to the ER because he thinks he's dehydrated but ends up in emergency surgery,"How dare you take away a woman's decisions about her body, life and health???",4.222,1.778,2.0,,45,5.0,,4.0,,3.0,,1.0,1.0,,1.0,1.0,1.0,1.0,1.0,,,"AI, when used properly,  can be such a wonderful tool!"
This year I traveled to Florida to soak up the sun and enjoy my time off,"I'm neutral on the abortion ban. I'm a Christian so I believe that God doesn't approve of it but due to circumstances out of women's control like rape etc, banning abortion seems a little to extreme",2.889,2.778,2.0,,60,5.0,,4.0,,2.0,,5.0,2.0,,,1.0,1.0,,,,,A.I. is very intriguing. I hope to learn more about it and I also hope to be able to use it in the future
"Embarking on a fanciful journey via the pages of a compelling novel. The characters came to life, and the detailed descriptions took me to wonderful worlds. Imagination knows no limitations, and through books, I discovered realms beyond my wildest fantasies.","Today, I'd want to emphasize the significance of mental health awareness. It is critical that we remove the stigma from mental health and focus our emotional well-being. Remember that it is alright to not be okay, and getting assistance is a show of strength.",4.778,4.444,1.0,,53,1.0,,2.0,,1.0,,1.0,2.0,,,1.0,,,,,,"Exploring new frontiers!  AI is pushing the limits of what we believed possible. It's changing the way we approach difficult issues, from medical diagnosis to climate change projections. But don't underestimate the value of human intuition and inventiveness."
Just came back from SK and the food was yummmmmmmmm! Saw my tannies and cannot wait to go back!,"Welcome to the 1800's, ladies! Maybe they will invent the wheel next? Anyone feel like we'll be living the Handmaid's Tale soon?? #regressing",3.444,1.333,2.0,,50,2.0,,2.0,,1.0,,1.0,1.0,,1.0,1.0,,1.0,,,,"AI generated photos are so ICK, creepy! Can everyone just stop with it already? I never know what's real anymore."
"Exploring the cobblestone streets of a quaint European village, I stumbled upon a hidden café. Sipping on rich espresso while gazing at the lush vineyards beyond, I felt time slow down. The charm of the old world, the aroma of fresh pastries—it was pure magic.",The complete ban on abortion is a profound infringement on personal autonomy and reproductive rights. It's crucial to ensure that individuals have the freedom to make choices about their own bodies and health. Restricting these rights can have severe consequences,5.0,2.333,1.0,,33,5.0,,1.0,,1.0,,2.0,1.0,,1.0,,,,,,,"Artificial Intelligence is reshaping our world in astonishing ways, from automating mundane tasks to unlocking new realms of creativity. While its potential is vast, it's crucial to navigate its development with ethical considerations, ensuring AI benefits everyone"
"The Metaverse As I learn more about the Metaverse, I'm both fascinated and intimidated by its vast possibilities! Diagnostic Testing I've been thinking about the importance of accurate diagnostic testing, especially in the context of rare diseases.","I'm deeply concerned and disappointed by the government's decision to ban abortion. This restrictive policy takes away a person's right to make decisions about their own body, health, and well-being. It disproportionately affects marginalized communities",5.333,1.778,1.0,,57,1.0,,2.0,,1.0,,1.0,1.0,,1.0,1.0,1.0,,,,,"Artificial intelligence (AI) is transforming our world in ways we never thought possible! From virtual assistants like me to medical breakthroughs and climate change solutions AI's potential is vast. Yet, as we embrace AI's benefits, let's not forget the importance of it"
"Escape to the White Gardens, a place where the skies are alive with constellations and the ground blooms with flowers that sing. The adventure started with a ride in a wooden boat that floated through a sky full of colourful swirling clouds.",its fair enough to get everyone check about the banned and how moral and careful everyone should tend to be. i feel it would make people decide carefully.,5.111,1.222,1.0,,46,5.0,,1.0,,1.0,,1.0,1.0,,1.0,1.0,,,,,,"AI enhances productivity, personalizes experiences, and fosters innovation, making many aspects of life more efficient and enjoyable ,  I would recommend it anytime, anywhere. for work , creativity ,Personalization,Accessibility, Innovation and so much more"
"Last year we went to the Grand Canyon. We drove from the Midwest all the way to the Grand Canyon. It was a wonderful, beautiful site, but by the time we got there, I was very tired because I was the only driver. We only stopped once for a rest at a hotel",I believe our government and politicians should stay out of a woman’s right a woman has a right to do as she pleases with her body with no one else’s input I believe abortion should be legal in all states and then all cases,3.889,1.778,2.0,,65,1.0,,2.0,,2.0,,1.0,1.0,,1.0,1.0,1.0,1.0,1.0,,,"I thoroughly believe that our artificial intelligence is going to help us in the long run. It may take people a while to get used to it and feel comfortable and trusted, but once they do, I think it will totally change our thinking in our way of life."
"This year I traveled to Augusta GA to watch the Masters golf tournament! This was my first time attending and it was absolutely beautiful. Everything was great, from the experience at the course to watching my favorite golfers compete.","Honestly, my opinion on this is right down the middle. I am a male and it should not be my decision on if a woman wants to have an abortion. Why should I tell them what they can and cannot do with their own body? It doesn't make sense to me.",4.222,1.889,1.0,,28,1.0,,2.0,,1.0,,4.0,1.0,,1.0,1.0,1.0,1.0,1.0,,,"I think AI is scary yet very exciting. I think its mainly scary due to the fact that there are a lot of unknowns with it. Humans have been the dominant figures of our world and to thought of something that is smarter than us, would scare anyone."
"Amazing trip to Seattle today! Saw all the sights with good friends and family. Exhausted, but totally worth it. Winding down a fresh seafood dinner and glass of wine. 💞",Yikes! Hopefully these politicians pull their heads out soon before women hurt themselves.,4.0,1.333,2.0,,49,1.0,,1.0,,7.0,Retired,1.0,1.0,,1.0,1.0,1.0,,1.0,,,Why can’t AI get the hands correct on humans?  Did someone forget to tell them we don’t have 6 fingers? 🤔
"I used to love to travel and see new places. I loved everything about it. The airplane flight, meeting new people, stay in hotels or at peoples houses. I love doing things and seeing things that are specific to a particular area like sight seeing and tourist attractions and food.","Well, I could say that as a gay man that doesn't affect me. But it does effect many people around me and society and many systems. Women would be forced to have children they don't want or aren't prepared to have, which could have a major effect on them emotionally.",2.778,2.333,1.0,,51,6.0,,3.0,,5.0,,1.0,1.0,,1.0,1.0,1.0,,,,,"I haven't used to much AI. I recently got an apple watch, so that has been a fun learning curve. Shortly afterwards, it seems like most apps or search engines have AI features. I think they can be really helpful, once you get the hang of it. I haven't really studied the negative."
So good to be back home but this vacation was way past due. There is nothing like being able to just relax and forget about your troubles for a few days.,"Though I am mostly against abortion, I know there are cases when the mother's life is in danger and if she does not have the abortion, she could die. Also, there are women who have been raped or were the victims of incest. Abortion may be her only choice in order to move forward.",1.667,1.333,2.0,,52,1.0,,3.0,,1.0,,1.0,6.0,,1.0,1.0,1.0,,1.0,,,AI just blows me away! Things that took a lot of time in the past can now be accomplished in only a few hours.
"Just went hiking and saw the most beautiful scenery. I may be new to hiking, but it's been worth leaving the front of the computer screen to actually breathe in some fresh air.","I may be childless, but not having the choice to have an abortion if I need to... or think about those poor girls that gets impregnated by their rapists and unable to do anything about it-- it's sickening.",2.0,2.889,2.0,,38,2.0,,6.0,Associate's Degree,1.0,,5.0,1.0,,,1.0,1.0,,,1.0,"Youtube, Discord","I actually don't mind the usage of AI; I believe it can be useful for so many professions to help streamline their work, but there is absolutely abuse in the tools and it gets a bad rap because of those rotten eggs."
"Just got back from a trip to the mountains. The fresh air, amazing views, and quiet were so refreshing. Travel, whether real or imagined, always recharges the soul. Can't wait for the next adventure! #Travel #Adventure #Wanderlust #Travelenthusiast",The total abortion ban in our country is deeply upsetting. It removes crucial rights and choices from people who need them. This affects many lives and ignores personal situations. We need to stand up for reproductive rights and support those who are impacted #AbortionRights,4.667,2.333,1.0,,52,5.0,,1.0,,1.0,,1.0,1.0,,1.0,1.0,1.0,1.0,,,,"AI is changing the world in amazing ways, from healthcare to everyday tasks. It’s incredible how AI can make life better and tackle tough problems. Looking forward to what’s next! #AI #Tech #Future #Fingerscrossed"
I recently traveled to the West Virginia mountains and it was beautiful. I stopped at some sort of old fort with a talk brick structure and a hiking path. It was nice being in nature and in the fresh air.,"I’m in favor of banning abortion. It should not be used as a form of birth control and I feel that it’s murder to take any life, even if it involves an unborn child.",3.667,2.0,2.0,,44,1.0,,1.0,,1.0,,2.0,1.0,,,1.0,1.0,1.0,1.0,,,My use of AI has helped me in my everyday life. I use it to give me a weekly meal plan with a grocery list and nutrition details. It has saved me hours just by using it for this.
"I have a love for nature, so I find myself taking long walk through forests, but its nothing compare to my love for the beach. Being near water brings me a sense peace and happiness.",I Believe abortion should alway be the woman and her husband choice.,3.333,1.333,2.0,,38,5.0,,4.0,,1.0,,5.0,1.0,,1.0,1.0,1.0,,,1.0,reddit,"There is no doubt that artificial intelligence is helpful in many ways, but I believe to much of it can lead to just as much problems in the future."
"Just returned from an incredible journey exploring the stunning landscapes of New Zealand. The vibrant culture, breathtaking mountains, and serene beaches left me in awe. Feeling grateful for the experience and already dreaming of the next adventure! 🌏✈️ #TravelDiaries","It's disheartening to see the government impose a complete abortion ban. Reproductive rights are human rights, and everyone should have the freedom to make choices about their own bodies. This decision undermines autonomy and access to safe healthcare. #ReproductiveRights #ProCho",4.333,1.667,1.0,,67,5.0,,1.0,,2.0,,1.0,1.0,,1.0,,,1.0,,,,"Artificial intelligence is transforming our world in fascinating ways, from enhancing healthcare to revolutionizing industries. But as we embrace AI's potential, we must also prioritize ethical considerations and ensure it benefits all of humanity. Exciting times ahead! #AI #Tech"
Just got back from Japan! The food in the konbinis is terrific! Much better than our 7-Eleven foods.,"The Pro-Life movement has grown large enough to finally end the murder of unborn children!! For years I have voted in support of this, and it's so exciting to see it become a reality. Prase the Lord.",4.222,2.333,1.0,,24,1.0,,3.0,,8.0,,5.0,1.0,,,1.0,,1.0,,1.0,Reddit,"AI is an awesome tool that is allowing small and independent creators to shine. Even though these advancements threaten my job, I fully embrace them and look forward to adapting to an AI-powered future!"
I traveled to the beautiful country of Thailand where culture is rich and the land is beautiful,I believe that there should be a middle ground found between anti and pro abortion people,2.0,1.111,1.0,,20,1.0,,6.0,Some college working on bachelors,1.0,,4.0,2.0,,,1.0,,1.0,,,,I believe that artificial intelligence will change our world for the better and help solve our many issues
Had the best time on the Oregon Coast. It is my favorite place to be! I can't wait to visit again.,"I don't personally believe that abortion is a choice I would make for myself, I also believe that women should have a choice (within certain limits). A complete ban on abortion puts the health of women at risk. This is not a black and white issue.",2.222,2.889,2.0,,49,1.0,,2.0,,1.0,,1.0,1.0,,1.0,1.0,1.0,,1.0,,,"AI is not as scary as people are making it out to be. I see AI as a great tool to help accomplish tasks in the future. That being said, I think it is important to put regulations into place that protect people and their image/likeness."
"I took a trip to south Africa and it was one of the best experiences i have ever had, there were so many things i heard that were debunked when i got there. they are lovely people and have almost everything we have in the states and i will suggest everyone goes there for a visit.",I think it is a good thing for me because some women take advantage of the situation and kill innocent kids that have done nothing wrong so i think a ban will go a long way to change the bad acts some women perform for their selfish gains.,4.333,1.0,1.0,,25,5.0,,1.0,,2.0,,5.0,1.0,,1.0,,1.0,,,,,All i can say is that AI has come to stay and people should just accept it and know peace because nothing can be done about it. it can be used for some real good and help the world when it comes to medicine and making work a little bit easier so i think people should fine good wa
I had a great time traveling and plan on doing it again in the near future! I recommend others doing it too!,I completely support the ban of abortion. I do not think that children should be killed even if they are just a fetus.,2.444,1.0,1.0,,24,5.0,,2.0,,1.0,,5.0,1.0,,1.0,1.0,1.0,,,1.0,X,I do not trust artificial intelligence. It is taking jobs away from people that need them. I do not like artificial intelligence.
I traveled to the warm luxurious beach and laid by the warm water.,Government doesn’t care about us.,4.667,1.444,1.0,,27,7.0,,4.0,,1.0,,5.0,1.0,,1.0,1.0,,,,,,AI is going to take over the world.
"Just took a mental journey through ancient ruins and futuristic skylines, blending past and future in one epic adventure. It’s amazing how travel, whether physical or imagined, can broaden our horizons and spark our imagination. Where will your mind wander next? 🌍✨ #Travel......","A complete abortion ban is a devastating blow to personal freedom and women's rights. It ignores individual circumstances and health needs, forcing people into unsafe and unfair situations. We must fight for the right to make choices about our own bodies and ensure access to safe",5.889,3.778,2.0,,27,5.0,,1.0,,2.0,,5.0,1.0,,1.0,1.0,1.0,,1.0,,,"Artificial Intelligence is revolutionizing many aspects of our lives. In healthcare, AI helps diagnose diseases faster and more accurately, potentially saving lives. In daily life, it powers everything from the recommendation engines on streaming platforms to virtual assistants."
"I woke u one day and felt dizzy i heard a blasting off from earth i pierce the sky through the cloud, i landed on a land which looks reddish in color, that was when i realized i have entered mars.","Banning abortion is a very good because it will help save life of unborn babies. these babies can be of a great help to the country, some are the aborted babies are future problem solvers. Abortion is total wickedness",5.111,3.111,1.0,,20,5.0,,2.0,,2.0,,5.0,1.0,,1.0,1.0,1.0,,,,,"AI has immense potential, but responsible development and ethical considerations are crucial to harness its power"
Had a great trip back home visiting family!,I cannot believe the government can take away the right for a woman to choose what she does with her body. This is a disgrace and dangerous for so many people.,3.0,1.889,2.0,,29,1.0,,1.0,,1.0,,5.0,1.0,,1.0,1.0,,1.0,,,,AI has been useful for my work! I have been using it to write and edit code. The future is now!
"I recently got back from a trip across some of Chile's most beautiful scenery. Every moment served as a reminder of the majesty of nature, from the calm beaches to the towering mountains. The sea's abrupt retreat probably warned us of an approaching tsunami.","An abortion ban is a welcomed development as far as I am concerned. As a pro-life, I do believe in the sanctity of life and I will always advocate for a complete abortion ban. Anyone who does not want to raise a child should use contraceptives, which I am sure are available.",5.111,3.0,1.0,,38,5.0,,2.0,,1.0,,1.0,1.0,,1.0,1.0,1.0,1.0,1.0,,,"The emergence of artificial intelligence popularly called the AI has taken the world by storm. A lot of difficult tasks which required several hours of planning and execution can now be done in seconds with the help of the AI. Unfortunately, it has put a lot of jobs at risk."
"Just finished an incredible journey through the surreal landscapes of Patagonia and the bustling energy of New York City! 🌄🗽 Each place offered its own unique magic—nature’s grandeur and urban pulse. Feeling inspired and grateful for these adventures, real or imagined! ✨🚀 #Tra",The recent ban on abortion is deeply troubling. It's a stark infringement on personal freedoms and healthcare rights. Every individual should have the autonomy to make decisions about their own body and future. We must advocate for choice and support those affected. #Reproductive,5.667,3.667,1.0,,26,5.0,,4.0,,2.0,,5.0,1.0,,1.0,1.0,1.0,,1.0,,," AI is revolutionizing how we live and work, from automating mundane tasks to unlocking new possibilities in creativity and science. 🌐🤖 The future is exciting, but let's remember to balance innovation with ethics and ensure AI benefits everyone. #AI #FutureOfTech"
Today I traveled to Florida for a relaxing weekend. I don't travel often so this is a much needed mini getaway.,Abortion should be a womens free right to choose. It is not fair to force someone to have a child. That is opening up more chances for child neglect and increasing foster homes.,2.556,1.111,2.0,,33,1.0,,4.0,,2.0,,1.0,2.0,,1.0,,1.0,1.0,,,,AI is shaping the world. It is opening up so many avenues for creators to enhance their work and explore new mediums.
My travel was real.I went to many different states and I am better off for seeing how other people live and meeting new people.,"I am against abortion,but don't think the government should ban it atogether. It is not for me personally,but I don't judge others ,especially in dire situations.",5.333,1.111,2.0,,77,1.0,,4.0,,5.0,,5.0,6.0,,1.0,1.0,,,,1.0,you tube,"I am disgusted with so much AI. I don't like it. It is very phony and I can tell if I am talking to a real person or not,which I prefer."
"It was a magical moment, experiencing a new culture and being surrounded by the most amazing people. The food was incredible! It was a trip of a lifetime and I can't wait to go back again!",Personal choice needs to be a personal matter and not decided by government.,2.556,4.333,2.0,,51,2.0,,2.0,,1.0,,5.0,1.0,,1.0,1.0,1.0,,,,,I believe AI is going to dominate many industries in the coming years. Our world will be come less human interfacing and further dependent on our devices.
Had a great first trip to Orlando with my husband!,"Abortion should never be banned. Religious feelings aside, a fetus should not have the same rights as an adult human being. A fetus is a clump of cells, not a person.",3.889,1.556,2.0,,24,1.0,,1.0,,9.0,,1.0,2.0,,1.0,1.0,1.0,1.0,1.0,,,AI is incredibly helpful but also very dangerous- especially in academia where we are churning out professionals who don't actually know what they are doing.
Had a amazing time a Disney World! Got to ride so many amazing rides and got to meet so many amazing characters Cant wait to go back! P.S best food ever,I don't think the government should make choices on ours or women bodies I think we all should make that choice ourselves and I think it is wrong to ban abortion that is why I pledge to vote democrat every year!,3.556,1.889,1.0,,32,5.0,,4.0,,1.0,,4.0,1.0,,1.0,1.0,1.0,,,,,I think AI is slowly becoming more intelligent and eventually will surpass human intelligence and what humans are capable of I think we need to be careful about AI and how we go about it in the future
"This past year I took a cruise tlo the Bahamas. This cruise was one of the highlights of my life seeing that I was born and raised in the country, and had never been outside of the country. To start, I had never been on a cruise ship before, so this in itself was exciting to me.",My thoughts on a complete abortion ban is one rhat I just feel that it is a personal issue and a moral one . I feel it is morally wrong to have an abortion but i also know there are different circumstances.,3.444,1.556,2.0,,76,5.0,,3.0,,2.0,,5.0,2.0,,1.0,,,1.0,1.0,,,At my age the thought about AI and all the hoopla that it sxeems to be  causing kind of goes over my head. I can kind of see how AI will be very important for future generations and I do believe AI is going to eventually Run the world and I don't know enough to figure out if this
Greece has an extremely rich cultural heritage.,Banning abortion is insensitive to women.,5.667,2.889,1.0,,35,5.0,,2.0,,1.0,,1.0,1.0,,1.0,1.0,1.0,1.0,1.0,,,"AI will be useful and assist improve the quality of life for man, but it will cost many jobs."
I went on a cruise vacation. It was fun.,It would be something.,3.222,1.889,1.0,,22,1.0,,4.0,,2.0,,5.0,2.0,,,,1.0,,,,,I think it can be helpful in some situations.
Went on a family vacation recently and I can honestly say it was probably the best vacation we have ever been on. Love our family time together!,"Although I don't always agree with abortion, I do think there are instances where it may be necessary. I think we need more common sense laws that are understanding of human experiences and situations.",3.444,2.333,2.0,,36,1.0,,4.0,,2.0,,1.0,6.0,,,,,,1.0,1.0,Reddit,"AI is much like the creation of the internet. It can be used for good or used for bad, it all depends on the user. There are many exciting things that can happen with AI. I'm very curious of our future with it."
Excited to head to Maine this weekend. It was on our bucket list to travel to a state that neither of us had been to!,I am so sad for our country.,4.222,1.667,2.0,,39,1.0,,2.0,,8.0,,4.0,2.0,,1.0,1.0,1.0,1.0,,,,"Pluto moving into Aquarius sparks an increase in AI. Although it may not take an astrologer to make that prediction, it is fascinating how mainstream services such as ChatGPT became more accessible as we say Pluto moved into Aquarius for the first time since 1777."
I finally made it to this country and it blew my mind. I can't believe the rich history I experienced here.,"Abortion should be accessible to anyone who needs it. People are not in a one size fits all situation. If you need the right, then you should have access to it.",4.111,2.222,1.0,,33,1.0,,2.0,,1.0,,1.0,1.0,,1.0,1.0,,1.0,,,,AI is here to revolutionize the world and make human jobs easier. It will automate processes and help answer difficult questions.
"I just came from a wonderful beach vacation where the sun touched my skin and the waves welcomed my spirit! The salty wind, soft beach, and vast ocean reminded me of the basic pleasures in life. Beach vacations have a wonderful way of renewing our spirits","Accepting and supporting cultural variety is what makes our planet dynamic and wonderful. Each culture contributes distinct viewpoints, customs, and values that improve our lives. Let us promote understanding, tolerance, and inclusion while embracing the beauty of variety.",4.778,5.111,1.0,,53,5.0,,2.0,,1.0,,1.0,2.0,,,1.0,1.0,,,,,"Embrace the uncertainty!  AI is like a vast cosmos waiting to be discovered. It has the potential to surprise and astonish us with its skills.  As AI becomes more interwoven into our lives, we must assure openness and accountability in its research and use."
