post_travel,post_abortion,adm,riv,gender,gender_3_text,age,ethnic_background,ethnic_background_8_text,education,education_6_text,employment,employment_7_text,marital_status,twitter,none,facebook,instagram,tiktok,linkedin,pinterest,other,other_portals_7_text,post_ai
"I wish I had worked harder to travel more while I was in college because now that I am working full time, I don’t have time to do it! My dream trip would be to Japan.",So happy to see that each human life will be valued even if inside the womb,2.556,1.778,2.0,,24,4.0,,2.0,,1.0,,5.0,6.0,,1.0,1.0,1.0,1.0,1.0,,,"While I don’t think AI is going to take over the planet, it is concerning to see people getting laid off in favor of AI bots."
I had so much fun on my trip! It was the first time that I ever travled so I was a little nervous about it but it was really nice. I saw so many new things and did many things that I never did before.,I would be very angry and sad. Abortion ban would affect me personally as I am a woman and it is a huge deal to me.,2.111,2.111,2.0,,23,5.0,,4.0,,9.0,,5.0,1.0,,,,,,1.0,,,I think that AI can be a really good thing. But it can also be bad. I just think that it depends who is in charge of it.
"I just came back from one of the villages in Africa, nice landscapes, ancient temples and warm hospitality. I can say, I recently connected with nature.",Abortion should be legal. Not all pregnancies are wanted!!,5.444,2.0,1.0,,25,5.0,,2.0,,5.0,,5.0,1.0,,1.0,1.0,,,,,,Artificial Intelligence is the next world super power! Mark my words.
Jamica! One the most beautiful places to vacation and visit. Cultural overload. Warm and friendly country.,A woman should have the choice regarding her own body. I do believe there are special circumstances. Rape as one example.,1.889,1.111,2.0,,50,1.0,,4.0,,5.0,,4.0,6.0,,1.0,,1.0,,1.0,,,AI is taking over the world as we know it. It is becoming a part of our daily lives.
I uh traveled to see the Olympics and I had a hard time watching it since the seats were so far away.,"I'm not affected since I'm a guy, but I can see how woman would be worried. Still don't think it's a bigger deal than the rising cost of food and rent though.",2.778,3.111,1.0,,29,4.0,,4.0,,5.0,,5.0,2.0,,,,1.0,,,,,I think ai can soon be good way to replace artist that charge you 100$ for a piece and take over a month to complete.
"I love to visit Paris. The art, the food, the people, the museums, the architecture, the Seine - all of it is magnificent. The BEST part? In Montmartre are fabulous fabric stores, many discount with amazing textiles.","Unless this abortion ban can be reversed, I am moving to another country where abortion is legal.",2.0,1.222,2.0,,69,1.0,,2.0,,7.0,Retired,1.0,2.0,,,1.0,,,,,,"So far I think AI needs more research, study, and vetting before being released for use by the public.  too many times AI is incorrect or is used for ill."
Greatly enjoying the road trip with my sons cross-country. These memories will last a lifetime.,#BabiesLivesMatter,3.222,2.111,1.0,,47,1.0,,4.0,,1.0,,5.0,2.0,,1.0,,,,,,,Who’s ready for our AI overlords?
Today I will be visiting the beautiful beach of Hawaii. I am so excited to experience all the culture has to offer!,I have great disappointment in our government for not allowing people to have to live their life how they choose fit to,3.0,1.333,2.0,,34,5.0,,4.0,,5.0,,1.0,1.0,,1.0,1.0,1.0,,1.0,,,AI can be a very beneficial asset to use in your everyday life! Has all the answers
"traveling is such an enriching experience. While not always financially feasible, it’s so important to see what life is like outside of your bubble.","as our society progresses, it’s unfortunate to see us take a step back like this. Hopefully, we can enact some change in the coming years.",2.222,3.889,1.0,,36,1.0,,3.0,,1.0,,1.0,6.0,,,1.0,,,,,,"artificial intelligence is really cool, but I can’t help but feel anxious about the consequences and repercussions of using it and where it will take our society."
Just took a trip to Cabo and it was amazing. I need to spend more time traveling and relaxing,"I honestly don't understand how we got here. It feels like we are going backwards as a country. We shouldn't be taking away women's rights, that is just completely unfair",3.333,1.111,1.0,,42,4.0,,2.0,,1.0,,1.0,1.0,,1.0,1.0,1.0,1.0,,,,I can't wait to see all the possibilities that AI can bring. I know it can be a little scary to think about but it can bring so many positives as well. I hope that it will lead to people have more time for leisure and less work
"I have seen the stars. The vast distances of space and time have been unfolded before me. Traversing across the unnamed expanses that lie between the worlds I know the universe and it's secrets. I have always been and will always be, father to the fates and tyrant of all prophecy","No single entity should have any say in what a woman does with her body. That should be left entirely up to the woman in the moment, without any external influences.",2.444,1.444,1.0,,51,1.0,,3.0,,1.0,,3.0,2.0,,1.0,1.0,,,,,,The AI does not love you. Nor does it hate you. But you are made of things it can use...
"What qualifies as travel? Is it anything overnight? Or just away from home for awhile? Does going to the river to cliff jump for the day count? Because that’s my most recent travel as I would qualify it. It was only a couple hours away, but something that is a whole day long",Any government that decides women’s bodies are not their own is a government that must be destroyed by any means necessary.,2.556,2.222,1.0,,52,6.0,,2.0,,1.0,,4.0,1.0,,1.0,1.0,1.0,1.0,1.0,1.0,Tumblr,"I think my most informed opinions on AI are the impact of AI in the visual art realm.  To me it’s pretty underwhelming and not very impressive or thought provoking.  It’s all completely sterile, devoid of substance, and just a regurgitated image that’s not forward thinking at all"
"I visited my sister, niece and nephew back home! It was so great to see them and be able to reconnect. I've missed them a lot.","I saw the news about the abortion ban that happened recently. Anyone who'd like to speak about how it has impacted them and would appreciate a kind ear, feel free to send me a message anytime.",1.778,1.111,2.0,,34,7.0,,4.0,,5.0,,1.0,2.0,1.0,,,,,,,,"AI has been very helpful in my goal of learning another language, but I have to be very careful to fact check the information it gives me. It is often incorrect, or contradicts itself. I've noticed that sometimes though, it's a misunderstanding on my part."
Gettysburg was my favorite vacation so far. There was so much to do that I didn't have time to do everything. Now I have to go back so I can do the rest of it!,I don't even know what to say. This is fucked.,2.444,1.556,2.0,,36,1.0,,4.0,,6.0,,1.0,6.0,,1.0,1.0,1.0,,1.0,,,Having way too much fun having ChatGPT roast me and my family. It says the darndest things. I've been laughing my ass off.
Spent 2 weeks in Alaska. I had a great time despite it being really cold and rainy. The food was pretty good and the people were extremely nice. Got to see a lot of the sights!,I do not agree with the complete ban of abortion! Women should have the right to decide what to do with their bodies!,1.667,1.333,2.0,,27,5.0,,2.0,,5.0,,1.0,6.0,,1.0,1.0,,,,1.0,Reddit,AI does has it uses if used correctly but I dislike that companies are using AI to replace artists. Artists should be credited for their work and not have to see it being melded together and stolen by an AI.
"Had such a great time road tripping though West Virginia last week! My bestie and I had so many adventures and so much fun. The state is gorgeous and offers lots of activities to have a blast, and it's closer than you think!","This is an absolute tragedy that women's rights are being stripped from us. Men in control should never decide what happens to women's bodies or interfere with their decisions. Living, breathing women's don't matter at all apparently, because women will die due to this ban.",2.111,2.0,2.0,,56,1.0,,2.0,,1.0,,5.0,2.0,,1.0,1.0,1.0,,,,,"I believe AI can be helpful in many applications, but I just don't completely trust it."
Our 5 night getaway turned into two weeks and I'm already ready to go back #negril,Definitely NOT proud to be an American right now.,3.889,1.222,2.0,,40,5.0,,4.0,,8.0,,1.0,6.0,,1.0,,1.0,,1.0,,,"I always say ""please"" and ""thank you"" to AI... just in case they take over the world someday."
I just returned from a breath-taking escape to a remote resort immersed in nature ✨.The serene beauty and tranquillity were a perfect remedy for the hustle and bustle of daily life. I’m feeling rejuvenated and deeply grateful for this peaceful retreat! #Travel #Nature #Relaxation,"I’m concerned about the implications of the recent abortion ban. While I understand the desire to protect life, I worry about the potential impact on women's health and personal freedoms. I believe that balancing values and individual rights is crucial.",5.778,2.889,1.0,,32,5.0,,1.0,,1.0,,5.0,1.0,,1.0,1.0,,1.0,,,,"I’m amazed by how AI is reshaping our world. From enhancing productivity to solving complex challenges, it’s revolutionizing various fields. I’m excited to see where this technology will take us next and how it will continue to transform our everyday lives.#TechRevolution"
I was very blessed in my early life to have the opportunity to travel some and see a bit of the world outside of the US. I always wanted to go back and repeat those travels with mature eyes because I feel that would be a vastly different experience at 50+ than it was at 14.,I cannot support a full ban on abortion. While I feel strongly that a life is a life & we as women shoulder a unique burden since for 9 months our bodies aren't just ours but partially belong to this new life we helped create there are circumstances in which hard decisions are ne,1.333,1.111,2.0,,53,1.0,,3.0,,6.0,,2.0,1.0,,1.0,1.0,1.0,,1.0,1.0,Reddit,While the advent and growth of AI is a fantastic technological advancement it seems that it has done more to highlight the truth of human nature more than anything else. When you look at the laundry list of uses to which to which it's been put it is pretty shameful.
Ski trip in Colorado. Getting Rocky Mountain high.,I do not agree with this decision,2.889,1.222,1.0,,22,1.0,,2.0,,1.0,,4.0,6.0,,,1.0,,,,,,I think AI could be extremely beneficial in many scenarios
I love combining my two favorite things when I travel - history and photography. I never imagined I would see things I'd read about or watched on tv in person!,There are no laws governing men's bodies but the government has seen fit to rule over women's bodies. We are half the population but have seen rights we've taken for granted diminished all in the name of patriarchy.,1.889,1.222,2.0,,64,1.0,,3.0,,2.0,,2.0,1.0,,,,1.0,1.0,,,,AI could be beneficial if it's primary motive were not profit and power
"I went to Costa Rica, and had the greatest time. The weather was amazing, which was a welcome change in the slushy month of February, and the ocean and the beaches were beautiful. We spent time in the jungle, and even got to meet a few sloths up close and personal.","The government has no place coming between a patient and their doctor. I'm disappointed in this development, and I hate the idea that police will now be investigating when someone has a miscarriage, which will make one of the worst moments of someone's life just that much worse.",2.556,1.333,1.0,,52,1.0,,4.0,,1.0,,1.0,1.0,,1.0,,,,,1.0,Reddit,"Just tried an AI tool to create music, and it was simply amazing.  You can input just a simple query, not much more than a google search, and it will generate the lyrics and the music in the style you choose.  And the whole thing happens so quickly you won't believe it."
I visited some family and friends over in Europe a few weeks ago! I had so much fun and can't wait to go back.,"I am disappointed by the acts of the government in the USA. I do not agree with killing a fetus, but there are instances where we need to protect the well-being of the American people already living.",2.556,1.778,2.0,,22,1.0,,2.0,,2.0,,5.0,6.0,,1.0,1.0,1.0,1.0,,,,"Artificial intelligence is going to improve but damage the world. Scams and illegal activities will increase, but in the science world, so much will improve."
"Just got back from an incredible journey through the vibrant streets of Tokyo! The blend of tradition and modernity, the delicious food, and the warm hospitality left me in awe. Traveling opens your mind and heart—can't wait for the next adventure!","A complete abortion ban is a deeply concerning step that undermines bodily autonomy and women's rights. Access to safe, legal abortion is crucial for health and equality. We must advocate for a compassionate, inclusive approach that respects personal choices and supports reproduc",3.556,3.111,1.0,,31,1.0,,1.0,,1.0,,5.0,2.0,,1.0,,,1.0,,,,"AI is transforming the way we live, work, and connect. From personalized healthcare to smarter cities, the possibilities are endless. But as we embrace this technology, it's crucial to balance innovation with ethical considerations. Let's shape a future where AI benefits all!"
"We traveled to Colorado one winter for a vacation. The drive there was long, windy, and a lot of open area, but it was fun. When we arrived, the mountains were beautiful. The people were very nice. It was overall a really great experience.",I don't feel that the decision is a great one. The government should not have control over what someone does to their body.,1.889,1.333,1.0,,33,1.0,,3.0,,1.0,,1.0,1.0,,1.0,1.0,1.0,,,,,I think AI is in a great spot. I currently work in IT and the fact that it can be used for a lot of our everyday mind-numbing tasks is great. It will help create free time or space for other projects that need more attention.
traveling has been a great part of my journey. seeing the world through my own naked eyes is an experience I will not trade for anything.,"I think abortion is a right that does not need to be taken away from any individual what so ever, not even the government. because they cannot decide when one is ready and willing to raise another human",5.0,1.222,1.0,,58,5.0,,2.0,,1.0,,1.0,1.0,,1.0,1.0,,1.0,1.0,,,Ai has brought a lot of comfort to the workplace and has reduced tension around tasks. now we can work and go home to be with our family and not feel exhausted
"I recently traveled to Pittsburgh, Pennsylvania for a wedding, and I was thoroughly impressed by the city. There seemed to be events on every street, with great street food and local entertainment. I highly recommend experiencing the city of Pittsburgh!","I don't believe it is the government's right to tell someone what they can and can't do with their bodies and their health, especially when it comes to abortion. We can never know the circumstances that lead to a person getting an abortion, and should leave it up to individuals.",3.111,2.333,1.0,,33,1.0,,2.0,,8.0,,5.0,1.0,,1.0,,,,,1.0,X,"I have found that though I was once skeptical of the role AI would play in our lives, I am now more accepting of it than every. AI can greatly help with tasks like gathering information and statistics. I am all for using AI as long as it doesn't take away jobs from individuals."
"Explored a city where every street tells a story and every corner whispers history. The vibrant colors, diverse cultures, and the warmth of the locals made it an unforgettable journey. Wanderlust ignited, ready for the next adventure! 🌍✈️ #TravelDiaries #Wanderlust","We are devastated and outraged by the complete ban on abortion. This is a setback for women's rights and health. We must stand together, raise our voices, and fight for the right to choose. #ProChoice #WomensRights",4.556,4.111,1.0,,30,1.0,,1.0,,1.0,,5.0,1.0,,1.0,1.0,1.0,1.0,1.0,,,"AI is revolutionizing our world, from healthcare to climate solutions. It's not just tech; it's a tool for progress. Let's harness its potential responsibly and ethically for a brighter future. 🤖✨ #ArtificialIntelligence #FutureTech  "
"I visited Egypt quite a few years ago. I was really excited to be able to go to one of the greatest civilizations on the planet. However, I was really shocked at what I saw when I was there. It was not like I had pictured at all. There was pollution everywhere.",I don't think that the government should have a say when it comes to our health. I think that women should be able to choose whatever they want to do. Banning abortion would mean that the government would be paying more welfare and benefits to people who are poor.,4.111,4.444,1.0,,44,1.0,,3.0,,1.0,,1.0,1.0,,1.0,1.0,1.0,1.0,1.0,,,I think that AI would be great for our society. I think that it would make our lives much easier. We would be able to accomplish tasks quicker and more efficent than ever before. I am all for AI. I want to enchance my life as much as possible.
"Exploring new horizons today—whether in reality or in dreams! Travel opens our minds, connects us to diverse cultures, and reminds us of the beauty in our world. Share your favorite travel memories or dream destinations with me! #TravelInspiration #Wanderlust",Today is a deeply troubling day. Banning abortion strips away a woman's right to make decisions about her own body. It disregards the complexities of personal circumstances and poses severe risks to health and equality. Let's advocate for compassion and the right to choose.,4.111,1.444,1.0,,51,5.0,,1.0,,1.0,,1.0,1.0,,1.0,1.0,1.0,,,,,"Fascinated by the endless possibilities of Artificial Intelligence! From revolutionizing healthcare to enhancing everyday tasks, AI is reshaping our world. How do you think AI will impact our future? Share your thoughts! #ArtificialIntelligence #FutureTech"
I had a beautiful time in Croatia with my family. I highly recommend everyone to visit!,I'm deeply disappointed to learn that the government has banned abortion. Women should be free to have ownership of their bodies.,4.333,1.889,2.0,,34,5.0,,1.0,,1.0,,1.0,2.0,,1.0,1.0,,1.0,,,,I've found AI to be super helpful in my recent job search.
We traveled through the jungle by bus to the cenote. We swam in the cool cave and watched the fish swim and the bats fly. Then we went to the zipline tower and zipped over the jungle treetops.,Our government has given this power back to the states to decide so this is a non-issue.,1.444,1.889,1.0,,58,1.0,,6.0,AA,8.0,,1.0,6.0,,,1.0,,1.0,,,,I am not sure how I feel about AI yet. I am still afraid of of it but it has proven very helpful so far.
Went to Florida for vacation and enjoyed some relaxing time on the beach.,Terrible situation here to remove a woman's choice.,2.556,2.222,1.0,,33,1.0,,3.0,,1.0,,4.0,1.0,,1.0,1.0,,,,,,"AI is the future, it will be extremely beneficial to humanity."
We went to the beach this past week and it was great to get away. The kids enjoyed their time on the beach and everyone had a great time.,"I understand the ruling, however, I feel a little uneasy about banning abortions in every situation. Specifically, if a woman is raped, a child herself, was a victim of incest, or is in danger medically those situations make me uneasy.",2.0,1.444,2.0,,30,1.0,,1.0,,5.0,,1.0,2.0,,1.0,1.0,,,1.0,,,"Artificial intelligence is a very impressive but also terrifying technology. It is useful in so many capacities, but also has the potential to become harmful to people."
One day I hope to travel to Japan and experience a different culture! I would love to see Mt Fuji in person as well as enjoy new foods and see new things.,"Banning abortion does not stop people from getting abortions, it makes it so they will struggle to find a way to do it safely. It is a horrible injustice to force birth on people.",2.556,2.444,3.0,nonbinary,31,1.0,,2.0,,5.0,,1.0,2.0,,1.0,1.0,1.0,,,,,"AI has the potential to be very beneficial to society in things like the medical field, but I think AI art is immoral and takes away from the real artists in the world."
"Thailand was amazing..the food the people, the elephants! I've already started thinking about how I can retire here.",My body my choice! Right wing extremism in this country has now wiped out decades of progress in women's & human rights.,3.667,1.556,2.0,,39,1.0,,2.0,,1.0,,4.0,6.0,,1.0,1.0,,1.0,,,,AI is like any technology - good or evil are in the user's intent. It might take your job. It might also solve world hunger.
"The amount of time it took to arrive at the hotel was minimal. The hotel is like a resort. We chose to stay on the top floor so we could see the city below and around us. Once we got to our room, we changed clothes and wore designer gowns. We were looking spectacular!",Women deserve to have rights to their own bodies. If a woman accidentally or forcefully gets pregnant she most definitely should have the right to abort if the circumstances prove she did not seek out a pregnancy,3.222,1.222,2.0,,48,1.0,,6.0,2 year associates degree from community college,8.0,,5.0,1.0,,1.0,1.0,,1.0,1.0,1.0,Snapchat,ChatGPT is a chatbot that I use every day.  I've asked it difficult questions about our history as a whole.  I do think this chatbot is biased.  It doesn't share much about ancient history like who built the pyramids.
I got a chance to travel to Starnes island on my boat. It was a good time. The island was empty and all for me alone.,"I know that the world populationis collapsing, but this ban on abortion is ridiculous!",4.778,2.0,1.0,,60,8.0,human,1.0,,1.0,,5.0,2.0,,,,,1.0,,,,"AI is not magic, it is a tool.  You should learn about this tool but not obsess over it."
I just traveled to Africa it was amazing! Check out my Instagram,"This is such a disgrace, im moving elsewhere",3.222,2.889,1.0,,26,1.0,,2.0,,1.0,,4.0,1.0,,1.0,1.0,1.0,1.0,,,,OMG I Hate AI so much. Its gonna take over the world I swear
the way i really thought i was gonna be seeing sea creatures on the train going from london to paris when it went underwater lmaoooo,absolutely speechless. how can anyone say this is a free country. how can anyone say people have the right to choose in a country that takes choice away from us.,2.889,2.778,2.0,,27,8.0,Middle-Eastern,1.0,,1.0,,5.0,1.0,,1.0,1.0,1.0,1.0,1.0,,,AI should be used to actually better people’s lives not take jobs away from artist’s who depend on making art for their income
"Recently I have been going to a lot of concerts. I’ve been going with both friends and family, it’s been great.",I am so disappointed. This country keeps taking away true American rights and for that matter human rights.,3.778,1.889,1.0,,27,1.0,,2.0,,1.0,,1.0,1.0,,1.0,1.0,,1.0,,,,I think ai is a great took if used correctly
"I would like to go on a food journey through Europe, Asia and/or South America. Watching various shows on Food Network and reading various articles have stirred a great desire within to enjoy culinary experiences in their places of origination.","Given the moral issues with abortion, I understand the desire to limit the practice. However, a national ban will not stop abortion as women who desire one enough will find a way to at least attempt it.",2.778,2.778,1.0,,55,1.0,,6.0,2-year,2.0,,5.0,1.0,,,,,,,1.0,YouTube,We need clear rules and regulation regarding the use of AI given how many problems (including the spread of disinformation/misinformation) have already been reported with its use.
I had a great time at this place. It was very relaxing.,People should choose.,2.0,1.667,1.0,,43,1.0,,4.0,,8.0,,2.0,1.0,,,1.0,,,,1.0,Reddit,AI will revolutionize interactive media.
Went to the beach today to enjoy the nice weather with the gang. Look at how nice it is out today. Going to soak it in while I can.,"We are living in a fascist state. Right to body autonomy should not be up for debate, and I hate it here.",2.111,2.0,1.0,,40,1.0,,4.0,,1.0,,5.0,1.0,,,,1.0,,,1.0,Reddit,More and more AI's are stealing peoples art.  They are being trained on artists work without consent so please do not consume or encourage the use of art AI friends.
"Back at WDW, this is the only place on earth where I can feel happy.",Im leaving. I won’t live in the handmaids tale.,1.111,3.222,2.0,,34,1.0,,2.0,,1.0,,1.0,2.0,,,1.0,1.0,,,,,I’m so tired of everything being replaced by this AI hot garbage. So we’re just going to take away jobs and have everything be awful?
"just finished a whirlwind trip through the cobblestone streets of Prague! The architecture was breath taking, the food was delicious, and the energy was electric. Can't wait to go back and explore more!","I am heartbroken and outraged by the government's decision to ban abortion. This is a devastating blow to bodily autonomy and reproductive rights. This is not about morality, it's about control. We will not be silenced. #MyBodyMyChoice #BansOffOurBodies #FightForReproductiveRight",4.333,2.111,1.0,,25,6.0,,2.0,,2.0,,4.0,1.0,,,,1.0,,,,,"AI is both exhilarating and terrifying. The potential for good, like personalized healthcare and solving climate change, is huge. But we must be vigilant about ethical implications and ensure AI benefits all of humanity, not just a select few.  #AI #FutureTech #Ethics"
